{
  "$schema": "https://builderforce.ai/schemas/basis-payload-v1.schema.json",
  "schema_version": "1.0.0",
  "basis_id": "a1b2c3d4-e5f6-7890-abcd-ef1234567890",
  "created_at": "2025-04-10T10:30:00Z",
  "agent_id": "agent-finance-unified-v2",
  "session_id": "session-abc-2025q1",
  "parent_basis_id": null,
  "claims": [
    {
      "claim_id": "c1a2b3c4-d5e6-f789-a01b-2c3d4e5f6789",
      "text": "Revenue is projected to grow 15% YoY in Q1 2025 based on historical trend analysis.",
      "confidence": 0.87,
      "confidence_method": "empirical",
      "tags": ["revenue", "projection", "yoy"],
      "status": "asserted"
    },
    {
      "claim_id": "c2b3c4d5-e6f7-8901-bc2d-3e4f5a6b7c8d",
      "text": "Marketing spend has a measured correlation coefficient of 0.42 with revenue growth.",
      "confidence": 0.72,
      "confidence_method": "heuristic",
      "tags": ["marketing", "correlation"],
      "status": "asserted"
    },
    {
      "claim_id": "c3c4d5e6-f7a8-9012-cd3e-4f5a6b7c8d9e",
      "text": "The external economic sanctions scenario presents a downside risk of 8% to the projection.",
      "confidence": 0.63,
      "confidence_method": "llm-self-report",
      "tags": ["risk", "external", "sanctions"],
      "status": "asserted"
    }
  ],
  "evidence": [
    {
      "evidence_id": "e1a2b3c4-d5e6-f789-a01b-2c3d4e5f6789",
      "claim_ids": ["c1a2b3c4-d5e6-f789-a01b-2c3d4e5f6789"],
      "type": "database_record",
      "uri": "https://api.finance.example.com/reports/q1-2025-forecast",
      "title": "Q1 2025 Revenue Forecast (Financial Core)",
      "excerpt": "Revenue projected at $12.4M, up 15% from Q1 2024 actual $10.8M.",
      "retrieved_at": "2025-04-10T09:45:00Z",
      "weight": 0.92,
      "provenance": {
        "source_system": "Financial Core",
        "source_version": "2.4.1",
        "checksum": "a0b1c2d3e4f567890abcdef0123456789abcdef0123456789abcdef0123456789"
      }
    },
    {
      "evidence_id": "e2b3c4d5-e6f7-8901-bc2d-3e4f5a6b7c8d",
      "claim_ids": ["c2b3c4d5-e6f7-8901-bc2d-3e4f5a6b7c8d", "c1a2b3c4-d5e6-f789-a01b-2c3d4e5f6789"],
      "type": "computed",
      "uri": null,
      "title": "Marketing Spend Correlation Analysis",
      "excerpt": "Pearson correlation 0.42 (p<0.05) between quarterly marketing spend delta and revenue delta, 8 quarters of data.",
      "retrieved_at": "2025-04-10T10:00:00Z",
      "weight": 0.75,
      "provenance": {
        "source_system": "Analytics Engine",
        "source_version": "3.1.0",
        "checksum": "b1c2d3e4f567890abcdef0123456789abcdef0123456789abcdef0123456789a0"
      }
    },
    {
      "evidence_id": "e3c4d5e6-f7a8-9012-cd3e-4f5a6b7c8d9e",
      "claim_ids": ["c3c4d5e6-f7a8-9012-cd3e-4f5a6b7c8d9e"],
      "type": "document",
      "uri": "https://docs.example.com/risk/sanctions-impact-2025.pdf",
      "title": "Geopolitical Risk Assessment 2025 - Sanctions Impact",
      "excerpt": "Sanctions escalation scenario estimates -8% revenue impact across EMEA region.",
      "retrieved_at": "2025-04-09T14:20:00Z",
      "weight": 0.60,
      "provenance": {
        "source_system": "Risk Document Store",
        "source_version": "1.0.0",
        "checksum": "c2d3e4f567890abcdef0123456789abcdef0123456789abcdef0123456789a0b1"
      }
    }
  ],
  "reasoning_chain": [
    {
      "step": 1,
      "description": "Query and validate 8-quarter historical revenue data from Financial Core.",
      "evidence_ids": ["e1a2b3c4-d5e6-f789-a01b-2c3d4e5f6789"],
      "claim_ids": ["c1a2b3c4-d5e6-f789-a01b-2c3d4e5f6789"],
      "inference_type": "lookup"
    },
    {
      "step": 2,
      "description": "Compute marketing-revenue correlation from Analytics Engine.",
      "evidence_ids": ["e2b3c4d5-e6f7-8901-bc2d-3e4f5a6b7c8d"],
      "claim_ids": ["c2b3c4d5-e6f7-8901-bc2d-3e4f5a6b7c8d", "c1a2b3c4-d5e6-f789-a01b-2c3d4e5f6789"],
      "inference_type": "deductive"
    },
    {
      "step": 3,
      "description": "Incorporate geopolitical risk from Risk Document Store.",
      "evidence_ids": ["e3c4d5e6-f7a8-9012-cd3e-4f5a6b7c8d9e"],
      "claim_ids": ["c3c4d5e6-f7a8-9012-cd3e-4f5a6b7c8d9e"],
      "inference_type": "deductive"
    },
    {
      "step": 4,
      "description": "Synthesize all evidence and reasoning into final projection.",
      "evidence_ids": ["e1a2b3c4-d5e6-f789-a01b-2c3d4e5f6789", "e2b3c4d5-e6f7-8901-bc2d-3e4f5a6b7c8d", "e3c4d5e6-f7a8-9012-cd3e-4f5a6b7c8d9e"],
      "claim_ids": ["c1a2b3c4-d5e6-f789-a01b-2c3d4e5f6789", "c3c4d5e6-f7a8-9012-cd3e-4f5a6b7c8d9e"],
      "inference_type": "abductive"
    }
  ],
  "uncertainty": {
    "overall_confidence": 0.81,
    "known_unknowns": [
      "External economic sanctions scenario not yet fully modeled",
      "Q1 2025 actuals will not be available until April 30, 2025"
    ],
    "assumptions": [
      "Marketing spend correlation remains stable for Q1 2025",
      "No major currency fluctuations affecting revenue",
      "Customer churn rate stays within historical bounds (< 3%)"
    ],
    "contradictions": [
      {
        "claim_id_a": "c2b3c4d5-e6f7-8901-bc2d-3e4f5a6b7c8d",
        "claim_id_b": "c3c4d5e6-f7a8-9012-cd3e-4f5a6b7c8d9e",
        "description": "Marketing spend correlation (0.42) suggests growth is partially due to spend; sanctions scenario (-8%) contradicts upside projection from marketing alone."
      }
    ]
  },
  "context": {
    "task_id": "task-finance-projection-2025q1",
    "task_description": "Generate quarterly revenue projection basis for Q1 2025 board review",
    "model_id": "finance-unified-planner-v2",
    "model_version": "2.0.3",
    "tool_calls": [
      {
        "tool_name": "query_financial_db",
        "input_summary": "SELECT revenue, marketing_spend, churn FROM q1_history WHERE year BETWEEN 2023 AND 2024",
        "output_summary": "Loaded 24 monthly records across 2 years",
        "called_at": "2025-04-10T09:45:00Z"
      },
      {
        "tool_name": "run_correlation_analysis",
        "input_summary": "Compute Pearson correlation between marketing_spend_delta and revenue_delta on loaded dataset",
        "output_summary": "r=0.42, p<0.05, 95%CI [0.12, 0.65]",
        "called_at": "2025-04-10T09:50:00Z"
      },
      {
        "tool_name": "retrieve_risk_documents",
        "input_summary": "Search for documents tagged 'sanctions' AND 'revenue impact' with date >= 2025-01-01",
        "output_summary": "Found 2 documents; top match is 'Geopolitical Risk Assessment 2025 - Sanctions Impact'",
        "called_at": "2025-04-10T10:05:00Z"
      }
    ],
    "environment": "production"
  },
  "extensions": {
    "com.builderforce.review": {
      "peer_review_status": "pending",
      "reviewers": ["agent-audit", "user-finops"]
    },
    "com.acme.risk": {
      "risk_exposure_score": 0.45,
      "risk_category": "geopolitical",
      "mitigation_plan": "hedge-20percent-options"
    }
  }
}